,sentence,subject,object,label,memo
0,"아르헨티나 요리(Argentina 料理, )는 남아메리카에 있는 아르헨티나의 요리이다.",,,,
1,"이탈리아, 스페인, 프랑스, 독일의 영향을 많이 받아 라틴 아메리카 내에서도 특이하고 고풍스러운 음식으로 손꼽힌다.",,,,
2,이렇게 아르헨티나의 요리가 유명한 것은 자국이 주요 생산물을 풍부하게 생산하기 때문이기도 하다.,,,,
3,"쇠고기를 비롯한 육류, 밀, 옥수수, 우유, 콩 등 주요 작물은 세계 수출국으로서도 이름 있을 만큼 생산량이 많은 편이다.",,,,
4,특히 밀의 경우 이탈리아식 피자를 만드는 데 더할나위 없이 좋으며 밀의 생산량 덕분에 이탈리아에서 나는 도우 못지않은 생산량을 자랑한다.,,,,
5,"또한, 아르헨틴는 건조기후인 지역이 많아서 채소보단 육식류가 더 많다.",,,,
6,아르헨티나 요리는 시골과 도시의 요리를 특징만으로 구별할 수 있기도 하며 세계화의 영향으로 발전한 도시의 요리와 전통 방식에 입각해 예부터 내려온 요리법으로 나뉘고 있다.,,,,
